user_id,recipe_id,date,rating,review
89435,31683,2005-02-06,5,"this is one of the easiest , tastiest recipes that i have made. we had a bunch of random things in the fridge... nothing really that fit together to make a meal and then i found this recipe. it turned out alot better than i had hoped. it is similar to a breakfast casserole but so much better!  i used (silk brand) soy milk instead of regular milk. i used a can of mixed vegetables (which had : carrots, potatoes, celery, peas, green beans, corn, and lima beans.) i also had some chopped brocoli that i added. i really liked the variety that the mixed vegetables added as well as it being easy ( just opening the can and pouring it in). i think it would be really good to add some tomato next time. will definately use this recipe again.
thanks tara!"
36944,31683,2006-01-18,5,"This recipe was so fast to put together and will make a very simple and delicious side dish or entree.  It gets an extra star from me for being able to use leftovers or whatever you have on hand.  I used corn, green peas,tomatoes and whole wheat bread.  Thanks for sharing your recipe Tara."
185708,31683,2006-01-21,4,"This was great for using up those bits and pieces in the fridge. I used a mix of leftover and frozen veggies (corn, peppers, spinach, peas) and diced ham to equal 3 cups. I buttered the casserole dish, but otherwise skipped the butter and didn't miss it at all. Also, I added a dash of hot sauce and 1 t. dijon mustard to milk mixture. Took almost an hour to bake, so I may try it at 350 next time. "
210117,31683,2006-02-04,5,"I love this recipe! As mentioned before it is a great way to use leftover veggies.  I doubled the recipe to use as a side dish for a large family dinner, then the next morning I heated the leftovers for breakfast for my husband and I. Thanks!"
147109,31683,2006-08-18,3,"This recipe is very easy, but just not to our taste I guess.  I thought the custard like texture was just not something we would probably like again. I might try it one more time with different veggies (I used corn, peas and green beans) or different bread (I used homemade bread). Thanks!"
141012,31683,2006-10-16,5,"This is easiest vegetable casserole ever, except for a bit of chopping that takes time. It always turns out perfect and looks fabulous. I have doubled and tripled the recipe on various occasions. It has never failed me, except once when I used zuchinni and it gave off a lot of liquid. There was a puddle at the bottom on the dish. I now saute vegetables like mushrooms and zuchinni that give off a lot of liquid if I have to use them. It is amazing the day it is made, but tends to lose some of its texture the next day. Highly recommend for a dinner party, Thanks for sharing"
458087,31683,2007-04-26,5,Tried it with mushrooms peas corn and peppers! Turned out really good!!
403089,31683,2007-08-13,4,"This recipes is really great!  I used some frozen veggies (corn, peas and spinach) wheat bread and mozz and it was mighty tasty.  I used it a side-dish along with some Aidells sausage, it was a fantastic meal and so simple only taking minutes to assemble.  I will definitely be making this again, it's a quick, tasty, versatile (ie; you can really make it with whatever you want!) meal. Thanks Tara!"
144897,31683,2007-10-09,4,This was easy to put together and tasty also.  I'll have to remember to try it with a different veggie combo sometime too :)
288351,31683,2008-02-06,5,"I made this with brussel sprouts, corn and mixed veggies.  It was a hit with my kiddos and DH.  I did have some watery issues at the bottom of the pan, but no one seemed that bothered by it and we hardly had any leftovers!  Great idea for leftover veggies!  I'll make this again and again. *The biggest hit so far has been broccoli, corn and carrots. Thanks!"
442988,31683,2008-03-06,5,"Loved it!  My husband declared that this was perfect comfort food.  The quality of the dish depends on what you put in it, doesn't it?  I used a ton of veggies -- 7 different kinds, and probably closer to five cups than three.  To keep it WW-friendly, I used Trader Joe's low-calorie wheat bread, skipped the margarine, used skim milk, and reduced-fat smoked Gouda and reduced-fat sharp cheddar.  And I topped it with a quarter cup of fresh grated Parmesan.  It was delicious!  Thanks so much for posting this."
167179,31683,2008-03-13,4,"I made this last night for the first time.  I used cauliflower, brocoli, and green beans and I used a blend of swiss and sharp cheddar cheese.  It is a mild dish; the texture and flavor reminded me a lot of the flavor and texture of quiche. Next time, I am going to try adding some onions and spinach and more cheese on the top.  Still a pretty good recipe.  Thank you for submitting it!"
323328,31683,2008-03-20,4,"We had this this evening and its pretty darn good!  I used a dense white bread, parmesan cheese in the mixture (probably closer to a cup), and sharp cheddar on the top to cover.  I also used skim milk and it was fine with that.
I keep a container in my freezer where I dump all the little bits or leftover veggies that I usually use in vegetable soup, so I just defrosted that and it was about 4 cups, so I just dumped it all in.  I think next time I'll be sure there are some onions in there, but overall it was very good.    I think spinach would be great as well as cauliflower.   The corn was also tasty in there!!
Thanks for sharing a great recipe for using up my veggie leftovers.  DH says its a keeper!"
61010,31683,2008-08-24,4,"This is a very good casserole on the order of a quiche with no crust.  It's versatile in that it adapts to any vegies, and I used leftover corn and peas, broad beans and zucchini.  I served it with tomato soup and it was a quick and tasty dinner."
281330,31683,2008-11-03,4,"Very good.  I used broccoli, red pepper, onions and snow peas.  Also, for cheese I used brie in the filling and chÃ¨vre noir on top.  It was a nice combination.
Thank you."
307059,31683,2009-01-03,4,"My family enjoyed this casserole.  Although my husband said it could use a little more flavor.  Next time I will use 1/2 evaporated milk as you suggested. I used brocolli, cauliflower and carrots for the vegetables.  Thanks for sharing."
317631,31683,2009-08-03,5,"My impression when looking over the ingredients was there wasn't much (besides salt) to accent the taste of the vegetables. So I added a chicken bullion cube to the milk, and also stirred in a blend of Italian seasonings, which included sage. My first thought when taking my first bite? Omigod - this is vegetable STUFFING! Really, just like stuffing at Thanksgiving, except instead of just bread and herbs and whatever other things some people put in, it's chock-a-block with vegetables. I think I would have found it a bit on the bland side if I hadn't included the extras that I did. As it was, it was really tasty comfort food. With all the cheese in there, I think you could also decrease (perhaps even omit?) the margarine. Shall try that next time and see how it turns out. In any case, I will probably even up the sage a bit - love that unexpected little savoury taste of Thanksgiving."
215898,31683,2009-10-07,4,Very good and easy to make!
1376400,31683,2009-10-24,5,"I altered the recipe quite a bit in term of flavoring but used the same amount of the backbone ingredients (milk, eggs, bread, cooked veggie). I made 2/3 of the recipe, used butter instead of margarine, added a cube of chicken bouillon, sprinkled the mixture with italian seasoning (as one of the other reviewers had suggested), used 1/4 tsp of salt and 1/4 tsp pepper for this 2/3 of the recipe. For cheese, i used half asiago and half medium cheddar."
1072593,31683,2009-11-15,5,A recipe boost for plain vegetables and likening it to the difference of shopping at K-Mart as compared to Neiman Marcus. Made for Alphabet Soup Tag.
252084,31683,2010-05-01,4,"Delicious, and even better texture when reheated the next day!!  I think 4-qt is a typo; mine fit in a 2-qt even with a little extra bread.  Picture seems to show a 2-qt. casserole dish.   And friends, please, use butter.  Margerine is NOT better for you and doesn't taste as good!  ;-)"
1800198467,31683,2013-11-05,1,"Mine wasn&#039;t creamy, it was more lumpy and mushy. Did I do something wrong?"
573325,286484,2011-11-16,4,"This is very easy and quick to prepare and makes for a delish breakkie. I loved how healthy this is and how nice the spices complemented the banana flavour. I think next time I might add a dash of cinnamon as well. <br/>THANKS SO MUCH for sharing this keeper with us, Cookgirl and THANKS to Tasty, too. ;)<br/>Made and reviewed for Veggie Swap #40 November 2011."
55122,67142,2003-11-13,1,"Tried this and had to throw it out.  I had the recipe for this cobbler somewhere, but misplaced it so I tried this one.  I do believe my original recipe calls for self-rising flour, not all-purpose.  Also, before it finished baking, I had to drain some of the liquid off.  I would drain the liquid from one of the cans of fruit and use half as much butter."
156034,145831,2006-05-09,5,"Thanks to Paul's recipe, I now weigh 9125 lbs.!  Just kidding...you could really do yourself in eating these though.  The texture is great and the flavors blend together extremely well.

THANKS FOR ADDING A NEW STAPLE TO MY RECIPE STASH!!!"
297543,145831,2006-06-03,5,Loved it!! Very rich and creamy and best of all it has my favorite..crispy bacon. These are fantastic kicked up mashed potatoes.
247940,163238,2006-04-07,5,"Oh, I love this recipe! My MIL taught me how to make it like this many years ago and it's scrumptious! *hint* This also works just as well with bulk sausage instead of dried beef."
9717,163238,2006-10-09,5,"I chose this recipe for PAC and my whole family loved it.  Thanks for posting a great ""comfort food"" recipe.  I will try it, as another reviewer suggested, next time with sausage.  Thanks again."
210188,163238,2007-01-16,5,"This is how I make mine. My father picked up this recipe, supposedly, while he was in the army (WWII). He taught my mother how to make it and I learned by watching. However, I use differentamounts and I make hardboiled eggs and slice them onto the toast before putting the chipped beef over it. Thanks for the suggestion of putting it over home fries.  I never thought of that!
Lee"
343262,163238,2008-01-17,5,"Great recipe ! One can also use part evaporated milk , it's creamy and isn't as expensive as cream. This is great made with ground beef that has been browned and drained. Add lots of black pepper and serve on toast or mashed potatoes. Either meat you use will make a warm filling meal. I've seen recipes that call for 1 cup shredded cheese to be melted into the white sauce."
56003,163238,2008-05-20,4,"This was really good, and brought back childhood memories.  My mother used to make this frequently as we were growing up.  Thnx for posting, Sherie17.  We will have this again."
369715,163238,2008-06-21,5,This was just as I remember. My mom use to make this all the time. We love chipped beef on toast but I have been buying the stouffers kind. Hubby said he was hungry for it and I had some chipped beef in the fridge and thought it couldn't be that hard to make. So I looked for a recipe and found this one. This was very easy to make and was wonderful. I followed the recipe exactly but added more milk at the end as it was a bit too thick for us. Will be using this recipe again- no more store bought for us!
1136209,163238,2010-02-15,5,This is how we make it also. The dried beef was always expensive so my mother would use good lebanon bologna and now that is what my kids prefer
952152,163238,2010-03-10,5,"Yes, this is true Pennsylvania Dutch Dried Beef!  Most people don't bother to brown the meat, or ""frizzle"" it as my dutch relatives say.  This really adds to the flavor.  Great recipe."
990914,163238,2012-05-25,5,While visiting my daughter in S. Pa. and saw delicious dried beef at a local market and purchased it to make some creamed chipped beef. My Dad was a cook in Korea and made this for us as children and I loved it. In my area all you can find is that awful jarred so called dried beef meat. I made your recipe and it was delicious. Thanks for bringing a fond childhood memory back to life.
1846441,163238,2012-12-02,5,"This is a great recipe.....a flavor I've tried many times to replicate and your technique did it.  I made a couple of changes.  For health reasons, I cut the butter and flour in half.   I sliced a bunch of green onions and sauteed them in the butter before adding the dried beef.  Then I split  the liquid equally between milk and creme fraiche. The creme fraiche has some nice qualities in this situation.  It is very tolerant to cooking temperatures and rich and creamy.  I also added a few tablespoons of white wine and a pinch of cayenne pepper.  It is magnificent.  I would say without hesitation that it is the basic recipe that makes this so successful.  Thank you."
2664120,163238,2013-02-07,5,"If you want the absolute best chipped beef for this purpose, I most highly recommend ordering it from S. Clyde Weaver online (a family-owned Lancaster county company, from which this recipe derives); their's is incomparable--being from Lancaster, I've tried from many purveyors."
1092246,309594,2009-01-11,4,Very easy to make
371672,309594,2009-01-13,5,"Excellent weeknight get-it-on-the-table-quick, oh-my-gosh-that's-good dinner (and complete in much less than the stated time - you should adjust that so you can list this as a one-dish, under 30 minute recipe).

I stirred in the thyme/oregano/garlic-powder in for a few seconds before the wet ingredients - a quick burst of dry heat brings out the flavor in dry spices.

Thanks for a great easy recipe, AllergyGirl (and 
Geshundheit)!"
465056,309594,2009-08-21,4,Very easy and quite yummy.
1084552,309594,2009-09-15,5,"Yummy, a wonderful staple at our house"
6357,95926,2004-07-20,4,"This tastes great when you substitute homemade chocolate syrup instead of mayo, IMO..Loved it! Thanks for posting!"
104621,95926,2004-07-21,5,"These are great! Ive made them  many times in the last few years, and they are just right  for a snack or lite lunch. The bananas dont have to be overly ripe to suit me. I have put a Tblsp of peanut butter on one slice of bread, and the mayo on the other.  "
26032,95926,2004-07-21,5,This is great!! My mother used to make these for me when I was younger.  I like this best with toasted bread.  Yummy!!!
33722,95926,2004-07-22,5,"I have made this since I was a kid and it is one of my favorite sandwiches.  I have heard about it with Peanut Butter, but nothing beats the mayo.  Don't knock it til you try it."
146637,95926,2004-11-02,5,My mom used to make these for me. I love them with salt and pepper. Very good.
202733,95926,2005-03-14,5,"Daddy used to make these for us when we were little, they were a BIG treat in our household.  Unfortunately, I have extremely low blood pressure and can no longer eat bananas, but oh I remember these sandwiches and how daddy would put lots of pepper on the mayo, simply delicious!!! And they don't give you that heavy feeling like peanut butter and banana sandwiches do  :)"
21841,95926,2005-04-08,5,Yum is right!  Been eating these for years.  Very fresh bread is a must.  Thanks for posting.....think I will have one for lunch today!
40560,95926,2005-04-09,5,"When I saw this recipe I couldn't believe it.  I had forgotten all about it.  it was my fav..as a a sub teen/teen/grandma.
GOOD GOING."
17803,95926,2005-04-10,5,"Being a mayo lover myself, this was just A-okay in my book!  I used one piece of white and one of wheat. Next time I make this I'll cut the mayo back to 1 1/2  teaspoon per slice of bread as my banana slices would slide around as I tried to eat the sandwich.  LOL "
125808,95926,2005-04-10,5,I grew up on these.  :-)
170959,95926,2005-04-24,0,I LOVE banana sandwiches made this way!! Never ate them any other way growing up. So glad to see that many others are now joining us in our mayo/banana lovefest!
29782,95926,2005-06-23,5,"Just came across this recipe. I also have made banana sandwiches for years. Its very easy and simple to make and taste is delicious. Some folks likes peanut butter in place of mayonnaise, I personally am a mayonnaise person. LOL  Thanks for sharing this oldie but goodie recipe! I have a banana so I think I'm off to make one right now. YUM!"
54271,95926,2005-08-07,5,I thought everyone ate these! SOOOOOOOOOOOOO good! The freshest bread possible is a must. DH likes mayo on one side and peanut butter on the other. You have to try this!! 
233014,95926,2005-10-02,5,I've been eating this since my dad introduced it to me 20 years ago. The only difference is he puts some salt in his hand and rubs them together over the sandwich. The little bit of salt adds a great flavor.
169969,95926,2006-02-02,5,After seeing Marsha D's photos and smelling the Buttermilk Honey Wheat Bread I had baking in the oven (recipe #128588) I knew I had a winning match. This was the best banana sandwich I have made!
302815,95926,2006-03-18,1,"A sandwich can taste great to one person and terrible to another. The banana with mayo just does not go, it has acidity and banana is sweet. I made it,i ate it ( at least tried), I throw it. I made it again as a sweet sandwich useing thick whip cream in place of the mayo. Try both yourself! I tested both  at a party, nearly all the mayo were left, the banana cream filling were all gone. Action speaks better than words.
davepearce1575@yahoo.com"
95372,95926,2006-06-13,5,The best ever!!!!  I moved to NM frome NC and nobody here even heard of mayo and 'naner sandwich!!! (or slaw on hot dogs!!!)
428463,95926,2007-01-12,5,This is my all time #1 favorite sandwich! If I go too long without it I crave it. I remember my grandpa making these for me and my sister when we were young. I have them at work for lunch all the time and people this I'm crazy but they just need to try it themselves!
106777,95926,2007-06-23,5,Love love love this sandwich - grew up on it!!  Peanut butter is good.. but mayo?? UNBELIEVABLE!!
47510,95926,2008-01-04,5,"I grew up eating these, haven't had one in ages, but this recipe sure did bring back some good memories.  My grandmother used to make these for me and they were delicious!"
292308,95926,2008-03-03,5,"When I was growing up, my dad ate one of these every Sunday morning for breakfast before church (with a glass of Tang :)  We also like them for a light dinner.  The tang of mayo (I prefer Dukes) goes well with sweet banana (make sure they are ripe!)  I actually had one for dinner the other night (b/f stumbling across this).  Do try it.  I've also seen people mayo one slice of bread, lay banana in it like a hotdog, and eat it like that :)"
4740,95926,2008-06-05,2,I don't know about this one.  I tried it and one of my daughters tried it and thought it was just ok.  It was good but I think I'd rather eat a banana by itself.
206442,95926,2009-08-29,5,"Oh my, I grew up eating banana sandwiches and I still eat them.  White bread & Dukes Mayonnaise.  Wash it down with a cold glass of milk.  Simple and delish!"
1612977,95926,2010-05-10,4,"I grew up eating these. Nothin' gourmet but sometimes this is the only thing that'll hit the spot. Fresh, white bread and Duke's mayo are essential."
122878,95926,2010-06-15,5,"I too grew up eating these and still do.  You've got to love the simplicity.  They are so, so good but darned if I can get my kids or grandkids to try them.  Oh well, more for me."
139381,95926,2010-06-16,5,"I too grew up eating these.  We did do them with just a light sprinkling of sugar.  Ahhh!  Nostagia!  I haven't eaten one in years, but I have bananas on hand and tomorrow just might be the right day!  Thanks for a lovely reminder!"
605574,95926,2010-07-31,0,"My family has eaten these all our lives, though a lot of people thought we were strange.  It makes a fabulous breakfast, snack or lunch.  They're great with wheat bread too!"
286566,95926,2010-08-31,5,"I made this for the DM and she loved the twist of having the mayo on the sandwich, I would have used about 2 teaspoons and 1 large banana and 2 slices of wholemeal/wholegrain bread. Thoroughly enjoyed, thank you MizEmerill, made for Potluck Tag."
844554,95926,2010-09-16,5,"Talk about bringing back childhood memories!!! When I found this recipe, I just had to make one of these again. I had forgotten how tasty they were. I thought we were the only ones to eat this but I can see I was mistaken. Thanks for memory lane."
475484,95926,2011-02-17,1,"Im sorry but you must have to grow up eating this to like it, It was like savoury and sweet that wernt meant to be"
526666,95926,2011-05-06,5,"This is such a treasured childhood memory...I love banana sandwiches and still indulge, occasionally! The bread must be fresh, and 'my' mayo must be Kraft! I sure appreciate your sharing this recipe, MizEmerilLagasse!"
2208765,95926,2012-03-11,5,"My dad use to make me these as a kid.  One of my favorites.  People think I'm crazy because I love these sandwiches, but they just don't know how good they are!  I also like to put chips on this sandwich too.  I like the crunch against the texture of the soft bread and bananas."
2210747,95926,2012-03-14,5,I love banana and mayo sandwiches! I grew up on them. Don't know where everyone is from but it must be a southern thang! Adding a sprinkle of sugar is also very good. I do know some people that like them with marshmallow fluff instead of mayo.
2401954,95926,2012-09-14,5,"This is a sandwich that requires no recipe: start with 2 slices of fresh, soft bread (white or wheat); slather on as much mayonnaise as you like on both slices of bread (I like the sandwich to be rather moist so I use a lot); put as many banana slices as you can across one slice of bread (I prefer to cut mine in lengthwise halves); and then cap the sandwich off with the second slice of bread (pressing slightly to create a nice seal).  Like others have said, this is a sandwich that reminds me of my childhood - I'd eat 2 of them most afternoons when I arrived home from school.  And most definitely, this sandwich is a Southern specialty.  Edited to add star rating."
2879123,95926,2013-06-26,5,They sound gross but........They are AWESOME
1803611854,95926,2015-01-04,0,"This is very close to a recipe that I have used for years, but let me tell you how to make it better:&lt;br/&gt;Add 1 Tbs of white sugar to recipe, but mash everything together in a bowl or food processor, spread on bread and enjoy."
2000355338,95926,2015-07-22,5,"Sounded odd when I heard the recipe (sorry for being French :) ), but it actually tastes very good, perfect balance between sweetness of banana and bread against the acidity of mayo. Sometimes it does not have to be more complicated than that !!"
2000533197,95926,2015-10-07,5,"I grew up eating this, but I&#039;ve had friends try it and love it.  Though they thought they wouldn&#039;t.  You have to use dukes mayo to make this work, though."
2000912079,95926,2016-03-09,5,"I don&#039;t like mayonnaise but tryed it without and it worked - was unsure if it really would but it did.
Looking into crisp sandwiches next wonder if ready salted is they right thing?"
2834180,95926,2017-01-30,5,"I love this recipe! I'm a 60s baby and I've been eating these all my life. Maybe it's justa Southern thing? Who knows? But, alas, I think these are awesome!"
2001569573,95926,2017-06-05,0,"Do NOT use overly ripe bananas. The bananas should be yellow and ready to eat, but not very ripe."
2000188242,95926,2017-12-23,5,"Guess it's a Southern &quot;thang&quot;, because I've been eating banana sandwiches my entire life! Sooooo good!! I slice my bananas long ways, use ONLY Dukes Mayonnaise and 2 slices of soft, white sandwich bread, THAT'S IT, NOTHING ELSE NEEDED!! So simple, yet so delicious!! Thank you, Mr. Lagasse, for posting an actual recipe and bringing attention to this old Southern delicacy. I was JUST now eating one and decided to Google it to see if it was just something my mother fed us as children alone or if it was an actual &quot;thang&quot;!! lol I'm so pleased to see so many other people enjoy these delicious sandwiches!! Mmmmm, think I'll have another!!"
2002174000,95926,2018-06-03,1,totally agree mayo and banana doesnt work
111342,166476,2006-06-21,5,"SUPER good!  Very easy and incredibly fast.  I added sliced avocado and green onions and what was supposed to be the side dish, turned into the highlight of my meal!  Will be making this again, thanks for posting!"
199848,166476,2007-04-25,4,"A very good, colorful, versatile salad.  I used medium salsa and low-fat ranch dressing.  I thought it needed onions, so I added some.  If I had fresh tomatoes (especially homegrowns) I think I'd use them in place of the salsa.  Thanx for a nice salad lunch.  I'll whip this again when I'm in the mood for a quick satisfying salad!"
374520,166476,2007-07-19,5,This is a perfect summer dish!  I leave out the ranch dressing because none of here like it and I cook some ground Bison with taco seasoning.  Even the kids love this salad!  Thanks for sharing.
1129191,166476,2010-07-23,5,"I needed a salad without mayonnaise, and this really was good. I used kidney beans with taco seasoning and fresh salsa (because I ran out of bottled), and everyone really enjoyed it. This is definitely a recipe keeper for hot summer days and BBQs!"
498271,370567,2012-08-01,4,"What a fun recipe!  You're right, it did take me a couple of tries to get the cheese right - had to find the right balance of time and temperature.  I used monterrey jack cheese and corn tortillas.  Served with salsa of course and really enjoyed - thanks for sharing the recipe!  Made for ZWT8, Chefs gone WILD!"
