user_id,recipe_id,date,rating,review
1695616,385071,2011-08-06,0,"copy and pasted review from the Food Network website...putting it here for easy reference for me when I get ready to try this out!.....""I've made this five or six times now and love it! The best variation I've tried so far is to dice finely one-half of a large Jalapeno and let it steep in the cream over the heat. Then strain the jalapeno flavored cream over the potatoes and sprinkle the Jalapeno bits on top. Be sure to do at least four layers of thinly sliced potatoes (two or three potatoes per layer and Mexican-blend cheese and overfill the tins slightly because it all compacts during cooking. I've also tried it with thyme-infused cream and other times I've used smoked cheddar, spicy jack, and gruyere cheeses. They were all great! These freeze and reheat nicely, by the way!"""
526666,385071,2011-10-19,5,"This recipe makes a nice presentation, if you feel like your potatoes are boring. I 'shaved' my potato, making the slices as thin as chips. I used a jumbo muffin pan, and filled all 6, making approximately 3-4 layers of potatoes, with cheese sprinkled in between the layers. Hard to believe there is no butter in this recipe. I was pleasantly surprised with how well these turned out. Tasty and crispy, they were devoured! When I want to impress my guests, I will pull out this recipe! Thanks so much for sharing, diner!"
590815,385071,2011-10-24,5,This recipe is really yummy my husband loved it and is very easy to make.
949568,385071,2012-08-08,5,"We had fun with these.  We didn't remove the foil halfway through.  The plus side of that is the potatoes cooked in 35 minutes.  The downside, they were pale and not crusty, and we had to scoop our portion out of the muffin cup at the table.  Taste-wise they were good.  Made for ZWT8 trip to Australia / New Zealand.  Thanks for the fun diner!"
1169750,385071,2014-07-31,5,"Made as directed.  Outstanding!  Slice potatoes wafer thin, use a good variety of swiss cheese and you can&#039;t go wrong."
1803423832,385071,2014-11-27,5,Don&#039;t bother inverting. I run a knife around them when they just come out of oven and then let rest for five to ten mins covered. Just run a small spoon around tin and they pop out. I use gruyere and salt and pepper tops before I spoon on cream. Don&#039;t have to make them that thick either to avoid longer cook times. Delish!!!
400708,385071,2016-07-14,5,"So easy, fast and impressive looking with great taste, what more could you want, using my food processor to slice the potatoes made it even easier, made it exactly as listed and loved it"
1068514,342698,2008-12-11,0,this brownie is so good and chewy i rate is as a 4
1028335,342698,2009-01-06,4,i used part splenda and since i have no mixer i winged it and mixed by hand. still tastes darn good! once i pick up a mixer i'll try again...
90180,124597,2005-06-11,4,"I'm always looking for a new way to do asparagus and this is a fine choice.  Simple and tasty.  Thanks, riffraff!  I'll be making this again."
29782,124597,2006-02-18,5,A great side dish! Loved the flavor from the marinade and grill! I only used 1/2tsp of cayenne pepper cause I was afraid it would be to hot tasteing for us. It was perfect! Thanks so much Riffraff for sharing this delicious recipe! 
171303,124597,2006-07-07,5,I made this asparagus to go alongside Middle Eastern Kebabs #94798 and we really enjoyed it.  I halved the recipe without a problem and the asparagus had a nice tang from the dressing (I used fat free Italian) and heat from the cayenne.  Thank you Riffraff for sharing this simple and delish recipe.
153188,109818,2007-12-01,3,"These were good.  Definitely a different twist on the same old carrot dish.  I liked the bacon in it, but I like bacon in anything!  Thanks for a change of pace."
542159,483632,2012-07-22,5,"Wow Hokies you were right this does make a fantastic open faced sandwich! I halved some ciabatta rolls brushed with olive oil and popped under the broiled along with the tomatoes. The ricotta really adds nice texture and body to the topping on these wonderfully flavored topping, yes I know a whole tablespoon of dried oregano sounds like a lot but it is the perfect amount."
452940,459273,2011-07-05,4,"What better way to celebrate the 4th and summertime than with fresh fruit. I placed rows of strawberries and banana slices rather than top the bananas with them. Although I didn't get 13 stripes, but it was still festive and delectable. :)"
179133,449891,2011-10-28,5,Yummy! I wasn't sure how many apples to buy for 4 cups so went with 4 large but only ended up needing 3 (about 1 3/4 lb) to fill the pan (and still have room for the topping!) I used 2 granny smith and 1 golden delicious. There was a lot of topping (which I loved!) I did have to bake a little longer for the apples to get tender (about 15 minutes extra). Thanks for sharing!
383346,449891,2011-11-22,5,This recipe is so yummy.  I used Empire apples.  I omitted the salt.  But other than that followed the recipe.  Thanks BarbaraAnn :)  Made for Cookbook tag game
39754,187210,2006-09-27,5,"Needed Cajun spice for Lemon Cajun Stir Fry <a href=""/142201"">Lemon Cajun Stir Fry</a>, but forgot to get any while out shopping. Made this and it was perfect, I reduced the paprika to 2 level tablespoons in a moment of cowardice and my suspicions were right as the heat was just right for us! Thank you for a great recipe...just when I needed it."
283251,187210,2006-11-10,4,"Fabulous! I made this for use later this week for my Parmesan Potato Wedges #192904. I love spice blends. Thanks for sharing. :)

ETA: Whoo! That's spicy! A little too hot for DH, but I like it! :)"
14410,187210,2007-03-24,5,Very good and very easy. I was making cajun chicken-fried steak and discovered...no cajun seasoning in the cupboard. I'll never buy another jar again!
1072593,187210,2009-05-25,5,Another one in my book of honory Cajuns!  Made for ZWT5
212609,187210,2009-06-05,5,"A great blend of spices!!
We used it on some oven fries,and they were SO delicious...a perfect amount of heat!!
This will get well used in my house,as it's so versatile and can be quickly whipped up from store cupboard ingredients.
Thank you for a great recipe...made for Aussie Recipe Swap June 2009."
841895,187210,2009-06-10,5,"I used this to make pork chops a few days ago. While the chops didn't come out all that great, the seasoning tasted really good. I will be keeping this around and looking for a better pork chop recipe to use it in. Thanks!"
678366,187210,2010-04-15,5,This is the perfect seasoning for French Fries! Ingredients always on hand and anyway this is not available in the stores so one more reason to be so happy for finding it. Thanks for sharing this.
463435,187210,2010-05-25,5,Great seasoning blend...wonderful flavor without one spice overpowering the other. It is one my family will enjoy as it doesn't add to much heat. Another plus is it is made with spices and herbs I always have on hand. Thanks for posting Elmotoo. Made and reviewed for the 40th AUS/NZ Recipe Swap.
383346,187210,2011-03-06,5,I made it without salt.  This is really good.  Tonight we tried it on french fries.  Thanks Elmotoo :)  Made for PAC spring 2011
870705,187210,2013-11-30,5,Great Cajun seasoning blend.  Not too spicy.  Like you did I tried it out on Redneck Epicurean&#039;s recipe#146464 and it turned out wonderfully!  Made for Aussie/NZ Recipe Swap.
47559,170336,2006-06-07,5,"I found a new cookie for my favorites cookie cookbook.  These are crunchy on the outside and chewy on the inside, and pack a wonderful spice flavor.  Very pretty and sparkly from the sugar crystals.  I don't really care for the taste of molasses, and tried Louisiana ribbon cane syrup instead.  It has the same color and texture, and a taste that is similar to the thick Dutch syrup I remember.  It worked beautifully in this cookie.  Thanks so much for posting this winner that will be made again and again."
145352,170336,2006-06-12,5,"SOOOOOOOOOO excellent!!!!! Thanks CIH!!!! But I have no idea how you got so many cookies! I ended up with 28....maybe I made them too big, but we loved them. A definite keeper!"
175492,170336,2006-06-16,5,"Ditto to Charmie's comments.  These are soooo darned good, and even make the house smell good while baking.  I used Black Strap Molasses, we really like molasses here, and these were the best.  Will be adding these to my cookies for gift making too as I am certain everyone will appreciate a box of these.  Thank you so much for sharing this wonderful recipe.  The Dirty Pan Gang RULES!!!"
63335,170336,2007-01-14,5,"I loved these!  I had to make them last minute, and i didn't have any ground cloves...but they turned out great!  I will make these again!"
457690,170336,2007-05-26,5,"LOVED these. I only made half a recipe so the dough was very wet seeing that I couldn't really ""half"" an egg hehehe. I didn't have any molasses so I used pure maple syurp and they still tasted soooo good. I also sprinkled in a little cayenne pepper to give it an extra kick. 

Because the dough was so wet they spread like crazy so the cookies were super thin but I still thought they were excellent! I will for sure make these again!"
548608,170336,2007-08-23,5,"I have looked for years for the cookies my best friend's Mom made when we were kids ... Spicy Crinkles they were called.  These cookies are exactly what I have been looking for.  I made them thin and crispy and I, and my whole family LOVED them.  They didn't last long!"
44420,170336,2007-09-16,4,"Great cookie!  I added some ground cloves and ground mace because I was in the mood for them.  The cookie has nice texture - crisp outside, soft inside."
61525,170336,2007-12-09,5,"These cookies came out delicious!  Mine came out very chewy because I accidently added the whole 1 1/2 cups of sugar to the cookie mixture instead of reserving the 1/2 cup for rolling balls in...yumm......!  I'll make these again and again!

Thanks for posting!  :)

Martha"
868673,170336,2008-08-22,5,"My DH took these to work every day for over a week and he asked me to make them again.  For him to tell me he likes something is unusual, so I knew he must have REALLY liked them a lot!  I made following the recipe exactly and the result was a crispy on the outside, chewy inside delicious cookie that we both really liked!  I can see why they won 1st place!  Roni"
31316,170336,2008-12-07,5,These are awesome cookies!  I added a bit of mace and allspice to mine and they are excellent.  Thank you very much for sharing your recipe.
426156,170336,2008-12-30,5,"This is an excellent spice cookie - crispy on the outside and slightly chewy on the inside.  I added a little allspice, and will also try some cardamom next time.  I just gave these a light roll through colored sugar (making some red and some green for Christmas) instead of coating them with regular sugar.  Because colored sugar is usually more coarse than granulated sugar, I find it leaves a gritty texture if the cookie is completely coated in it.  Thanks for a very good recipe."
1800179196,501408,2013-11-02,1,"This was a fail for me!  Maybe because I used a handmixer, but I ended up with something very much resembling scrambled eggs and looking absolutely nothing like a pancake!"
2766292,501408,2013-07-16,5,"Try it , won&#039;t regret it!!!"
341486,501408,2013-07-20,1,"Sorry, this was not for me at all.  Tasted like a thin banana omelette. After I&#039;d made a few and the family all pulled faces I added flour, baking powder and milk to the remaining batter and made pancakes out of that.  They said the first ones had no &quot;bite&quot; to them."
2941555,501408,2013-08-12,5,"These are great, the kids love them! Mom and dad too!"
2958004,501408,2013-08-24,5,Very nice :)
1800042747,501408,2013-09-02,3,After reading some other reviews I thought what the heck. I added 1/2tsp of vanilla. The first few bites were interesting but soon after knew it was a banana omelette!! LOL Still worth a try just to say you did!! :)
1800044428,501408,2013-09-03,3,"I thought these were very good, for what they are.  I did add vanilla extract, just to give them a nicer flavor.  Will definitely be making these again."
1800258076,501408,2013-11-16,3,"Try adding only one egg and use yellow banana. Not overripe. You will have thin eggy pancakes with a too sweet banana flavor. Also, use minimal spray or oil as these can easily become too greasy. If they are too thin, a tbsp of flour will help."
1801221164,501408,2013-12-24,5,I put 1/2 tsp of Vanilla Extract
1802411092,501408,2014-01-25,5,"love! added vanilla. blended in bullet quick. very thin, cooked in butter. awesome! i don&#039;t mind the &#039;eggy&#039; flavor. needs no sweetener."
1802423641,501408,2014-01-28,5,So yummy...need to add cinnamon though!
1802430546,501408,2014-01-29,5,Turned out better than I expected. Definitely making again.
1802527471,501408,2014-02-25,4,"Added vanilla essence as per other reviews, also (on a second run) added 1 1/2 tsp of unsweetened cocoa. The result was pleasingly chocolatey, though it did need a little bit of extra sweetness added.&lt;br/&gt;&lt;br/&gt;There&#039;s probably a disconnect between US and UK pancakes here - UK (though not Scottish) pancakes are usually quite thin, closer to crepes, US pancakes tend to be thicker. These will turn out thinner, like a UK pancake."
1384367,501408,2014-03-05,4,"I make these &quot;pancakes&quot; for my babies and they love them. (And these are the babies who throw scrambled eggs on the floor and drive their mother crazy by not eating protein.) They are thin and a bit eggy, though, so I&#039;ve got to go with four stars because they aren&#039;t really like pancakes. If you&#039;re looking for traditional pancakes, go elsewhere. Overall, these were a success! I recommend them for anyone with toddlers."
1802653462,501408,2014-04-08,1,This was very earthy to me; it need sugar or something.
42462903,501408,2014-06-20,5,"My daughter, who does not like eggs and never opts for protein, loved these.  They did not need extra sugar as you are going to put syrup anyway.  I would next time as per other reviewers try some cinnamon, chocolate, vanilla or banana extract.  But just as is was great for my 5 year old."
11395289,501408,2014-09-09,5,"This is a go to recipe for our house!  My toddler loves these and she typically doesn&#039;t like eggs!  We add 1/2 tsp of vanilla, sprinkle of cinnamon and a tsp of Sunflower Butter  (peanut butter).  We make in the morning and my husband and I take them in the car and eat on way to work, our daughter eats them with jam or sometimes syrup.  We made this with a potato masher... plus it was fun for our daughter to help."
1803298711,501408,2014-11-03,4,"For these pancakes I ended up blending the two ingredients making a very smooth and fluffy batter. Then continuing to add cinnamon, Salt and vanilla extract. Personally these worked very well considering I have a gluten-free diet they were fast and easy and very yummy. Don&#039;t make these pancakes thinking that they&#039;ll taste like wheat pancakes. With these pancakes I added peanut butter which pair nicely with the bananas."
11800120,501408,2014-12-02,3,Wait. I wrote an earlier review but forgot to say that I did one to one ratio.  One banana to one egg.  It was perfect.
1803680891,501408,2015-01-19,5,"This is a super quick, super easy, super healthy recipe that helps satisfy my pancake craving. Yes these are very thin a lot more similar to crepes so don&#039;t make these expecting your typical fluffy buttermilk pancakes. To enhance the flavor I also add a little vanilla extract and cinnamon to the mix. To help with the texture whip the eggs well before incorporating with the bananas and also add a little baking powder. This will make it a little fluffier. Finally I throw in a tsp of chia seeds to up the health factor and serve with a little maple syrup. Yummm."
1803739347,501408,2015-02-02,5,Excellant. Taste really good &amp; gave me my pancake fix without blowing my carbs for the whole day. They are best cooked slow &amp; watch for burning. Second side cooks very quickly.
2000085148,501408,2015-03-24,5,"Quick. Healthy. Delicious. Packed with protein and energy! As a student, this is an enrichment in my morning routine."
2000111149,501408,2015-04-03,1,Tastes like a banana omelette.
2000113837,501408,2015-04-04,5,"Loved this. Tasty with just the right amount of sweetness. I doubled the recipe and took away one egg, so I used two bananas and two eggs and it was perfect. Added 1 tsp of vanilla, 1/2 a teaspoon of cinnamon and a tablespoon of ground up flax seeds to up the health content. Delicious!"
2000119862,501408,2015-04-05,1,"Well this was just disappointing. I don&#039;t know what I really expected but it tasted like banana and egg. Like another review said banana omelet, so just imagine adding bananas to your omelet which no one would and you have an idea of how this tastes. To be honest just cook the eggs and have the banana on the side much better and quicker! I don&#039;t eat pancakes often and this is a poor substitute. I&#039;d rather eat real fluffy thick pancakes smothered with butter and syrup once a year than make this again. People who gave this good reviews have obviously not had real pancakes in sometime."
2000134188,501408,2015-04-12,5,"delicious!!! they weren&#039;t too thick and i could finish the whole plate and i was full, not miserable, afterwards. i added a pinch of brown sugar, cinnamon, and vanilla extract by default, b/c that&#039;s what i do out of habit whenever i make pancakes. so yummy!"
2000187002,501408,2015-05-05,0,"Love this recipe! I also add vanilla paste or essence, cinnamon and berries at the end on top as well of youghut. I am on a health kick and this is the perfect, quick easy and yummy breakfast"
2000214796,501408,2015-05-20,4,"I found the one banana, two eggs was too runny. So I added another banana, and it was great! I also added a splash of cinnamon. Keep the pancakes small and they cook better too."
2000215790,501408,2015-05-21,4,"This is so delicious! I must agree that it is a little flat, but in all honesty it&#039;s healthiness outweighs it&#039;s appearance. Lactose &amp; gluten free! Will definitely be recommending it to all of my food intolerant friends :)"
2000222870,501408,2015-05-24,5,Loved these! Tasted just like normal pancakes which surprised me and my sister. I made a raspberry coulis to go with them and they were so good! Will definitely make these a lot more. Plus they&#039;re a much healthier alternative! Thanks!
2000226627,501408,2015-05-25,5,Very easy to make tasted just like a pancake. I used a food processor to blend smooth and also added some organic raw honey. Very nice recipe. Thanks.
2000260587,501408,2015-06-10,3,Doesn&#039;t taste bad! Especially if you add some vanilla extract and cinnamon but the texture.... Mine turned out looking like scrambled eggs. If you can ignore the looks and focus on the taste then it&#039;s for u!
2000261110,501408,2015-06-10,3,"I&#039;m not sure why would any one call this a &quot;pancake&quot;; I agree this is more like a sweet banana omelette or a banana crepe. It&#039;s not terrible, a bit plain in my opinion. It needs some fruit, honey, nutella,peanut butter  or nuts (or what ever you like) to enhace its flavor, otherwise it tastes as a banana omelette. I agree with other review I read earlier, who ever called them &quot;pancakes&quot; has not eaten real pancakes in a while. Still not bad, but I preffer to make mine like a crepe with something inside next time."
2000280265,501408,2015-06-19,5,"Mine turned out amazing!
I tweaked it a bit.. 
2 eggs
1 banana
Tbsp of weight control maple brown syrup oatmeal (Quaker)

Topped it with strawberries and a tsp of maple syrup"
2000287799,501408,2015-06-22,4,"Overall, I love these pancakes! They are healthy and easy, not to mention they taste great. The only things I can say about them is that they are super hard to flip, but once you get the hang of it, it&#039;s magic!
Also, I recommend using a blender instead of hand-mixing the ingredients and using honey and fruit to top it for a healthier alternative to maple syrup. And instead of using PAM, use coconut oil to rub across the pan.
I am about to make them right now again and I am going to put some cinnamon in it for extra flavor.
Have a nice day!"
2000340556,501408,2015-07-15,5,Absolutely love these pancakes. My family eats them up and asks for more.
2000383049,501408,2015-08-04,1,"It works sure, and if banana and egg is your thing then it will be great for you!
But for me it was a weird combination and the spongy omelette consistency was far from &#039;crepe like&#039;. 
Perhaps my egg to banana ratio was off?"
2000420418,501408,2015-08-22,5,Great way to get rid of overripe bananas. Classic breakfast in my home :)
368043,501408,2015-08-31,4,"I have made these a few times and really enjoy them.   Although I did alter the recipe a bit.  First, I only use one egg for one banana.  And then I add a tablespoon of flour for just a little bulk.  They taste like pancakes to me with these two changes."
2000449728,501408,2015-09-02,4,This recipe is great if you are trying to loose weight as a healthy and low calorie snack. However 2 eggs make it taste to eggy. One egg to one large/medium banana is just fine. Especially if you want to keep the sweet taste of the banana.
1801553725,501408,2015-09-12,1,"Terrible texture, terrible taste.  Worse with syrup.  Don&#039;t waste your ingredients.  This will never pass as a pancake."
2000474827,501408,2015-09-14,5,"I Love these pancakes -- I originally saw the recipe on Pinterest but that one added cinnamon to the mix and I really think that makes a difference. It gives it more flavor and the pancakes come out a little more brownish and looking like regular pancakes. Anyway, they are light, delicious and the kids and I love them. One piece of advice would be to be sure they are firmed up before trying to flip them or it will fall apart and not look so nice. So cook it mostly on the one side, the flip and cook for just 20-30 seconds on the other side."
2000526525,501408,2015-10-05,5,"I added Cinnamon and Vanilla to the mix, cooked them well on the griddle and they tasted very good. I topped with a bit of peanut butter and honey. Perfect for a light breakfast! My son loves them. He&#039;s 8 months and literally inhaled them."
2000540454,501408,2015-10-09,1,"I am sorry, but this didn&#039;t work for me at all. It looked like banana scrambled eggs. To not waste the ingredients I threw half of the banana/egg mix to some complete buttermilk pancake mix I had home and added some water to soften the mix. I ended with a fairly good pancake. It was a bit too fluffy because I added baking powder to the banana/egg mix but at least it was edible."
2000431901,501408,2015-10-30,5,"These were great! We whipped the eggs really well first, then added the banana and used the blender to make it totally smooth. Also added 1/2 tsp cinnamon. They were similar enough to real pancakes, a wonderful grain free substitute. So sweet from the banana that they didn&#039;t need syrup, we just topped them with chopped kiwi and strawberries. My two year old actually did all the work except the cooking, and gobbled three of them down."
2000648966,501408,2015-11-07,4,Adding a 1/2 teaspoon of baking powder helps make them more of the consistency of a regular pancake. I also add a little vanilla and cinnamon. You can even throw in some choc chips tho that obviously detracts a bit from the healthiness. :)
2000688081,501408,2015-11-17,4,"A ratio of one egg to one banana is definitely the way to go. Delicious banana flavor, no need for syrup. I had trouble flipping them, they tend to fall apart. Cook over lower heat and use a lid."
2001061706,501408,2016-06-24,1,"If you like scrambled eggs with bananas mixed right in, this recipe is for you. The egg to banana ratio is too high."
2001102034,501408,2016-07-25,3,"It tastes really great but I found the batter really thin, so when it came to flipping the pancakes they just fell apart - it would work better for pancake bites than full sized pancakes :)"
2001084886,501408,2016-09-13,5,I make these pancakes all of the time. They are great and low calorie. We top with fresh sliced strawberries and a dot of cool whip.
1801189345,501408,2016-10-24,5,"Made these this morning and I was pleasantly surprised. Didn't know what to expect. Used recipe, as is, with no additions. My husband loved them, too. What is easier than two eggs and a banana on a griddle? Healthy, quick, and no mess."
2001354586,501408,2017-01-16,0,"Was ok, even one egg and one banana was still too runny, added some pancake mix to it. First pancake was ok, 2nd and third from the mix were better. Next time I will try 3 bananas and 2 eggs. 1.5 banana to 1 egg seems like a better ratio."
2001362345,501408,2017-01-22,4,"We didn't have any of the problems others are listing here when made as the recipe directed. We made sure the griddle was nice and hot, and we used about 2 Tablespoons of &quot;batter&quot; per pancake -- no problems flipping. Worked great, tasted great. Added a little maple syrup to a few of them, but the blend of banana and maple flavors was weird to my palate, and it didn't need it. I tweaked the next batch to a 1:1 ratio and added cinnamon, ginger, and vanilla. I liked the consistency better on the 2nd batch."
2001364700,501408,2017-01-24,4,I adjusted the recipe: - 1 ripe banana - 1 egg - 1/2 tsp. vanilla extract - 3 tablespoons flour Topped with crunchy peanut butter and/or syrup. Very tasty and easy!
2001368868,501408,2017-01-28,4,This was amazing!!!!! I didn't whisk the eggs enough though :( My bad.... lol
