user_id,recipe_id,date,rating,review
2109227,100864,2014-10-19,5,"Delicious!  I split the topping from the recipe out into two crisps in smaller dishes, one with fresh sliced peaches and the other with apples.  Absolutely loved it, I did need to bake them 10 minutes longer to get the top super crispy....but that is just a personal preference of mine.  Try this recipe you will be glad you did."
1803677177,100864,2015-01-25,4,"I adapted this for a bit more flavor (we&#039;re serious about cinnamon! also, the apples weren&#039;t ideal but they needed using), for a lot less sugar, and for no wheat or gluten.&lt;br/&gt;I also changed the preparation method slightly: &lt;br/&gt;* For brown sugar, I substituted 1-1/4 cup stevia powder, plus 1/4 cup of molasses (added the molasses later, with the butter).&lt;br/&gt;* For 1 tsp cinnamon plus 1 tsp nutmeg, I substituted 2 tsp cinnamon, 1/4 tsp salt, 1/2 tsp nutmeg, 1/4 tsp ginger, 1/4 tsp white pepper. (This may have been too much, even for our spice-loving family, if it had all gone into the crumb topping.)&lt;br/&gt;* For 1 c flour, I substituted a half-cup each of almond flour and sorghum flour. (I could have just used sorghum flour or rice flour or all-purpose gluten-free flour, or even buckwheat flour, which goes well with oats. Don&#039;t try using coconut flour as a straight substitute for anything else ever, though; that&#039;s weird stuff, needs it&#039;s own recipe.) &lt;br/&gt;* When I sliced the apples, each set of slices got dumped into a bowl of water with lemon juice, right away, to keep them from browning.&lt;br/&gt;* Next, while the oven pre-heated,  I mixed the spices into the stevia powder -- before beginning to layer the apple slices. Before the first layer, a thin scattering of spiced sweetener powder went into the pan; then, after each layer was completed, another thin scattering on top. &lt;br/&gt;* Then, the flours got stirred into the sweetener, and the oats, then the molasses and the butter.&lt;br/&gt;I could have used less butter, as it doesn&#039;t take much of anything to dissolve the stevia powder, but I didn&#039;t, so the &quot;crumble&quot; was a little on the moist side.  It took a little work to keep it crumbly instead of forming a nearly solid crust (not that there is anything wrong with a solid crust! if anybody goes in that direction, though, remember to leave some vents so the dish can easily let off steam). It turned out pretty well! Next time, we will use more oats in the topping. Also, if we have some cranberries or blackberries, we&#039;ll add a handful or two of those and back off on the spices, for a different twist."
2000041789,100864,2015-03-05,0,so great
2942654,100864,2015-10-09,5,"I have been trying to find a great Apple Crisp recipe for years and now I don&#039;t need to look any further! It&#039;s so easy to make and memorize. Most importantly, it doesn&#039;t turn out soupy. The crumble is crunchy and flavorful. My friends loved it! I find that using Granny Smith apples for baking is best--especially if you prefer tart and sweet. Excited to make this one again and again!"
593835,100864,2015-11-02,2,"I carefully read all the reviews and thought, &quot;how could I go wrong?&quot;  This did not turn out for me as the others reported.  It was way too sweet.  Even though there was no sugar mixed with the apples, the 1-1/2 cups of brown sugar was too much.  The topping was not crunchy at all, it was almost dry.  I followed the recipe exactly, except that I used a large oval Pyrex dish to bake it in."
2000645615,100864,2015-11-06,5,"Excellent and easy to make apple crisp.  Since it&#039;s just me and my husband, I divided the recipe between two disposable pie pans and froze one for later (we&#039;ll see how that turns out).  We&#039;re trying to eat healthier, so I made a couple of tweaks--for the flour, I used half whole wheat and for the butter, I used the Earth Balance Buttery Spread that works for baking.  It was delicious--I especially loved the flavors of the cinnamon and nutmeg.  My husband loved it, too--this one&#039;s a winner."
2000656899,100864,2015-11-08,0,"Sorry, this was one of the worst apple crisps I&#039;ve ever made. The crumble on top was just that a lot of crumble. I won&#039;t even give a star rating."
2000712172,100864,2015-11-25,1,I found this to be too dry. Will never make it again.
2000805160,100864,2016-03-23,0,"Wow! So easy to make, the best apple crisp!  Thank you so much for this recipe.  I served it with vanilla ice cream with caramel sauce it was Yum!  The only changed i made in this recipe is the sugar, i add 2 tablespoon of mascuvado sugar and the topping 1 tablespoon only.  Its a keeper."
2001005709,100864,2016-05-09,5,"Excellent! I had a lot of apples to use up, and this did the trick. Very tasty. I'm not a nutmeg fan, so I omitted that, but that's the only change I made. The whole pan was gone in 2 days."
2001207659,100864,2016-10-15,5,I love that i change portion control My husband even helped make it
2001227692,100864,2016-10-31,3,"Fruit/Topping ratio very good. Taste, very good. Texture very bad. Loose and powdery topping. 1/2 cup butter, even well blend is inadequate. Needs minimum 3/4cup and optimally 1 full cup to coat and crispin dry ingredients. So dry that even additional baking time would not help!"
2001605700,100864,2017-06-30,4,The recipe is great EXCEPT for the nutmeg. Next time I will be omitting it. It's very overpowering in this recipe.
493093,100864,2017-07-01,1,I guess if you like gummy oats (like in an oatmeal cookie -yuck) you might like this recipe. Has a seriously large pile of sugar too.
2001652865,100864,2017-08-02,1,"I disappointed myself today as I tried to make this for a luncheon at work, so I was naturally in a hurry and I for got to use the brown sugar. So sad. So I am wondering if I just melt the brown sugar and add what dry ingredients I can get into the pan if that might work just as good."
2002099131,100864,2018-04-06,5,"I remember making nearly this exact recipe for a certain fast-casual dining establishment on the east coast that’s no longer in business. As the restaurant manager, I had to set the par for how many to always have on hand, and it never seemed to be enough. I’d get us set with a number that would do ok for a couple weeks then suddenly it wasn’t enough. These were the most popular item on the menu next to the chicken itself."
2002274032,100864,2018-09-13,5,Excellent recipe! So easy! So tasty!
400708,100864,2018-11-12,5,"Fast, easy and oh so good, I even made a HUGE mistake; forgot to put in the brown sugar and had dumped the mix on the apples when I remembered. Had to pull out the apples, add the sugar and then repour on top; whew - even with that big error it turned out delicious and my whole family loved it. Thanks so much for posting this wonderful fall recipe"
58038,37073,2003-08-27,4,These look just like french fries and are very easy to make.  A lot of options with the seasoning too.  2 Tbsp of margarine doesn't sound like enough but it is plenty.  2 yo DS loved these french fries and gobbled them up.  Thanks for the recipe.
169969,37073,2005-11-15,5,Everyone enjoyed these and I loved that they were so easy to clean up after than fried potatoes. I will make my fries like this more often. Thanks Dancer!
197023,37073,2005-12-03,5,"A fabulous low calorie, low fat way of enjoying “fried” chips!  Very easy to make, very clear instructions, very quick and together with ellie_’s Spinach With Sesame Seed Recipe #138862, they made a totally delicious lunch.  The weather had turned suddenly much cooler today, and I felt like some sort of comfort food, so I made just a quarter portion, which in step 9 I sprinkled with dried oregano and sage.  Thanks Dancer^ for sharing this recipe."
157136,37073,2010-04-05,4,"These were good.  We used oregano and I didn't like that flavor, my husband and boys did though.  I think next time I will add a little salt instead.  Thanks for sharing."
442988,280918,2008-02-08,5,"Thanks so much for mentioning this!  I don't know why I never thought of it, but I didn't -- and this was SO much easier and neater than frying it in a pan.  It wasn't just that I could avoid the splatter -- it's that I could do other things while the bacon was cooking.  Thanks so very much for posting this!"
17803,280918,2008-02-12,0,"I have the same recipe baked at a lower temp,  Recipe #187790"
345569,218648,2008-03-04,4,"These were gone within 48 hours, which must mean they're good because there were only two or three people eating them!  We have a similar recipe in my family, only ours is chocolate instead of peanut butter... this went over well, though.  VERY peanut buttery -- maybe because I hate measuring out gooey things like peanut butter, so I guesstimated, and I may have put in too much.  I couldn't find a 12-oz box of corn flakes, so I used 8 cups.  I got twenty good-sized cookies.  Thanks for posting!"
36079,206585,2007-02-04,4,I added some cocoa to this mix (two tablespoons) and came up with a delicious chocolate cheesecake that was very easy to prepare.  Note however that it's two 8oz packages of cream cheese (for a total of 16oz) not two 16oz packages.
469903,206585,2008-04-07,3,"This didn't quite work out for me...  I used lite cream cheese, made my own graham cracker crust and followed directions as noted being careful not to overmix - it seemed pretty thick to me but I don't make cheesecake often so I just put it in the oven. Oh, and I swirled some raspberry jam on the top. After 40 minutes it didn't appear much different, so I turned the heat up to 350 and baked for another 5-7 minutes until it was brown on just the very outer edges - it never did appear jiggly so I couldn't use that as a gauge. Waited overnight to try and it was  just ok today. Made for PAC Spring 2008."
98722,196264,2007-05-19,4,"This is a good idea for all that leftover zucchini.  I left out the sugar as my tomatoes were sweet enough.  We had it on homemade pizza, very good.  Thanks!"
1182736,196264,2009-07-19,4,"Great Idea for the zucchini, I added fresh herbs and garlic.  Be great for a quick meal later. Thanks a lot for another good idea."
32671,8606,2002-03-04,5,it is different and i think my family should like it
659896,8606,2008-10-13,5,Very delicious and easy in a pinch.  I would recommend adding some oregano and basil to the sauce just to make it a little more interesting.
197023,8606,2009-01-22,5,"I loved the sound of this mushroom sauce and was certainly not disappointed. I made it as the sauce to use in Linda's Busy Kitchen's Recipe #254585, which I was making a large quantity of to put in the freezer. So I made four times the recipe. Proportionally, I used less Worcestershire sauce: I appreciate the subtle flavour it adds but I am always wary of its heat. I used Aldi's canned,  chopped Italian tomatoes (the best around) and I added three leeks as I love the blend of leeks, onions and garlic. I also added some rosemary, sage and thyme as we love that blend. This was a really delicious sauce and one I'll be making again. Thank you for sharing this recipe, Claire."
861336,8606,2009-12-28,5,"Love this recipe. Quick, easy and delicious."
5060,8606,2010-03-27,4,"Very tasty sauce with the mushrooms, parsley, garlic and onion, the combination adds lots of depth to the tomatoes.  Love the touch of Worcestershire sauce and I used lots of pepper.  I cut the oil down to just one tablespoon, a quarter cup seemed like a lot.  Worked out just fine.  Served over spaghetti with turkey meatballs.  Loved how quick it was to put together and will be making it again, thanks for posting."
1346465,8606,2010-05-21,5,"Wow ... this is seriously good. I added about 1/8C white wine and 1/2t of Italian seasoning during the simmer, but the recipe probably didn't need them. By the second or third bite, you're hooked!"
1928133,8606,2011-06-09,4,This is the first time I tried to make spaghetti and I am very sure that it will become one of the usual suspects during a time and taste crisis. My parents and sister liked it so much that they actually told me that I had become taller even though I stopped growing a couple of years ago. I am usually very critical about my cooking but I have to admit that your recipe made me feel like a decent cook. Thanks a ton.
239706,8606,2011-12-24,5,"I was in the need for a quick sauce tonight, and this one fit the bill since I had all of the ingredients. I was so pleased with it. I added some fresh oregano and thyme which I had growing in the garden. I also added a pinch of sugar to counterbalance my not-so-fresh tomatoes. I think I will add white wine next time as suggested by another reviewer. Thanks for the perfect recipe. I'll definitely do this one again!<br/><br/>Revised 8/23/10 -- Just cooked this sauce again. This time I used fresh garden tomatoes and a white wine I had in my fridge. I again added fresh oregano and also a little fresh basil. Boy was this good! I'm not much of a cook, but this would be a good recipe for guests. Can I add a sixth star?"
464080,8606,2013-05-02,4,"I had a cup of diced tomatoes and 8 oz of baby Bella mushrooms in the fridge is this fit the bill.  Mine was very watery and a bit bland so I added a little white wine, a pinch of sugar, some Italian seasoning and simmered it for almost 40 minutes to dry it up a bit.  Since it was watery I chose to serve it atop some truffled polenta.  The combo of the two was four stars (the truffle flavor boosted the dish) but the sauce alone would be 3 in my book."
424680,301951,2008-05-24,5,"Great tasting jam/spread/sauce, whatever you want to call it & however you want to use it! So easy & wonderful! Definitely keeping this around so I can make some of the other variations, too! [Tagged, made & reviewed for the Summer Salad & Berry Recipe Challange]"
252514,301951,2011-08-07,5,"This makes a nice tasting, tart jam. And it comes together very FAST! I didn't strain out the raspberry seeds as I had this on wheat toast and it was fine that way. But if using as a sauce for ice cream, I would probably go the extra mile and strain out the seeds. Thank you, JackieOhNo! [Made for the All You Can Cook Buffet special]"
542159,301951,2011-08-25,5,"Wow this really is the best thing since sliced bread! There are lots of things to love about this recipe, it tasty great, it's easy, it makes just over a cup and has lots of yummy variations. I made strawberry and am looking forward to trying the other flavors. Thanks so much for the post."
578177,311959,2008-07-21,4,Another good recipe from SI!  I made two bags and plunked them in the freezer.  This weekend I put one bag in an 8x8 pan and baked.  The texture was dry but the taste was good.  Next time I will bake with a foil cover.
779751,311959,2009-01-20,5,Awesome recipe!  This is one of my favorite baked bean recipes ever.  We served this at my DH's 60th surprise birthday party and it was a huge hit with everyone.  I
1804431,311959,2011-01-31,5,I cant get my hubby to stop eating it!
243533,136112,2005-09-16,5,I thought it called for too much cheese but made as directed and we all enjoyed it immensely.  Don't have Brie often and that was a ncie addition to the asparagus.
240832,136112,2005-09-18,4,Made it exactly as directed. Might cut back just slightly on the amount of cheese (just a bit too much) but the overall taste was great. Great Sunday dinner addition!
199848,136112,2013-04-16,4,"Really cheesy and good.  Almost too much cheese as written, though (maybe a typo?).  I used 6 oz of each of the cheeses listed and that was plenty.   I only cooked the asparagus for 3 - 4 minutes before placing in the oven.  Ten minutes would make the asparagus too soft and mushy.   Thanx for posting this!"
468351,497150,2013-11-09,5,"Quaker has changed their oatmeal cookie recipe over the years, which all have been pretty good!  I like this one!  It is a keeper. It is simple, delicious, and most importantly to DHs liking.  :) The only change I made was; instead of using all butter in the recipe, the full 7/8s cup of butter, I used &frac12; cup unsalted butter (1 stick) plus 6 tablespoons of buttered flavored Crisco.  A perfectly delicious cookie!"
393426,274746,2008-01-04,4,This was pretty good.  I substituted a few thin-sliced onions for the cheese.  The only thing I would say is that it definitely took the pototato longer than 1:30 to cook.  I think i ended up cooking mine for about 3:30.
369715,274746,2012-09-25,3,I used four red potatoes and doubled the rest of the ingredients. These were good but real greasy. I would cut the oil in half next time. Mine also took a lot longer to cook. I had to cook mine for fifteen minutes. I topped it with some cheddar cheese which added to the grease too but they tasted good.
1911882,496213,2013-05-10,5,I had to try these! these were honestly pretty good! I did use apple cinnamon instant oatmeal added some chopped pecans. for only having two ingredients these defiantly helped my craving for a cookie...lol without the guilt! I will make these again!
2882644,496213,2013-06-29,4,"As a diabetic this recipe really intrigued me.  I must say it exceeded my expectations.   I like my cookies a little sweeter, so I will add a little Splenda or (pure/organic) honey to sweeten them up.   &lt;br/&gt;&lt;br/&gt;I give them 4.5 stars, but the real test will come when my grandkids try them."
1802849661,496213,2015-08-31,5,Great recipe and so simple to make! Perfect for snacks or breakfast on the go!
1802738659,496213,2015-11-11,4,"These should not be considered &quot;cookies&quot;. Really, this recipe should be called &quot;build your own energy bar/snack recipe&quot;. I&#039;ll make this again, but probably as a bar, and with more add ins. As-is, it&#039;s very gummy, and a little bland...and I added peanut butter and sugar on top! It&#039;s all good as long as you&#039;re not expecting this to be a cookie or a dessert. Still, it was easy and fine for my tastes."
2001744935,496213,2018-03-09,5,"Loved these ... and I love good health ... and easy things ... made these smaller, added cinnamon. Made in my toaster oven. Deliciously easy and plain."
80560,20238,2003-04-14,5,"Very easy to make if you know how to separate eggs and beat egg whites. Fortunately, I do :) My wife and I ate the whole souffle for dinner by ourselves."
117781,20238,2004-05-28,0,"Honestly, this souffle is absolutely delicious.  Although, the ingredients make a fantastic dish, the instructions need a bit of work.  If a person had never made a souffle before, this recipe would be a disaster. It needs to be clear that the egg whites need to be whipped in a separate bowl to a stiff peak and that the yolks should be whisked together in a larger, separate bowl to allow room for incorporating the cheese sauce and egg whites.  To avoid scorching the cheese sauce, it needs to be stated that the butter should be melted over medium heat before adding the flour and that the flour should be whisked in thoroughly with the butter. I did not let the butter/flour mixture cook very long before adding milk that I had warmed in the microwave which helps avoid the lumps you get if you add cold milk.  If you incorporate the milk in small batches and whisk thoroughly each time, it yields the smooth sauce necessary for a souffle.  There is no mention when to add the salt, so I added it into the cheese sauce mixture along with fresh ground pepper and a pinch of garlic powder.  Before adding the sauce to the eggs, they need to be tempered so as not to scramble them. I whisked about a 1/8 cup of the warm cheese sauce into the egg yolks to temper, before whisking in the rest of the sauce. The egg whites should be folded in very gently in two batches so as not to lose the air you have just incorporated.  Also, to get a tall souffle that does not spill over the sides, take a strip of foil and butter it. Wrap the foil around the souffle dish (butter side on the inside) like a collar that will stand a good 6 inches or so above the souffle dish. This really did take exactly 30 minutes to bake. The urge to open the door and check it should be resisted so as not to have the souffle fall too early on.  It comes out beautifully and it is absolutely delicious, with a nice cheese flavor in each fluffy bite. It melts in your mouth and is just wonderful.  I sprinkled with chives before serving. Imagine my surprise when my picky 2 year old wanted to try it and ended up eating more than I did.  With these instructions added to the recipe, I would rate this 5 stars!"
59064,20238,2005-08-06,5,"This was my first ever attempt at any kind of souffle because it seemed perfect for a quick dinner in front of the TV with the kids.
It is very easy to prepare as long as you assume that the egg whites need to be well beaten. I didn't temper the eggs with the sauce and got away with it as I move fast! I have a small convection oven so I went for 23 minutes and then left the souffles in the oven for another 5 minutes."
99325,20238,2006-05-22,4,This is a good basic recipe. I can't wait to vary it!
254614,164100,2006-04-13,0,This is mine kind of recipe. Can hardly wait to try.
198971,429838,2011-02-27,5,"Excellent taste from a really simple recipe! I wasn't sure how the dried oregano would taste (we usually use fresh), but it turned out to be great. I think using butter to brown the onion, and adding the olive oil and basil only at the end makes a surprisingly good difference."
529571,429838,2011-09-25,0,"Great, simple, EASY sauce. I've been looking for a good simple, quick sauce for what feels like years and this is it! America's Test Kitchen never disappoints."
2689893,429838,2013-02-12,4,This is definitely a good recipe. Very easy too.<br/><br/>Try adding a splash of Burgundy wine after adding the tomatoes or white wine just before you add the tomatoes!
2906339,429838,2013-07-18,5,"I make this every time I make something that calls for tomato sauce and it is phenomenal. Just tart enough, just salty and flavorful enough. Amazing!"
2912533,429838,2013-07-22,5,"This is my new go-to recipe for pasta or pizza sauce. For decades I&#039;ve been using a recipe that relies on tomato paste, which meant that as long as I had a can in my pantry I could make a red sauce, but today all I had was crushed tomatoes. Boy, was that a good thing! My whole family agrees that this is a GREAT recipe, especially with the 2 T of fresh basil (which grow in a pot on my window sill year-round). I appreciated the note about the science behind the instructions and ingredients; it sure makes a difference. Make this! You&#039;ll be glad you did!"
185142,429838,2013-12-24,5,"So easy &amp; delicious! I used 1 tsp dried basil instead of fresh because I had none. Other than that, I followed the recipe exactly. I served it over homemade pasta"
241385,429838,2014-01-05,5,"Made this in a pinch when I was out of store bought sauce.  Truly just 10 mins to make, easy and absolutely delicious!!! I did few variations, I added a handful of peppers I had on hand, used Muir Glen whole plum tomatoes (used immersion blender) and I like a really seasoned sauce so added a little extra seasoning. I will for sure be making this again!!!!"
1802704192,429838,2014-04-29,5,Quick and easy recipe I came across after discovering I was out of jarred pasta sauce.  No more pasta sauce for our kitchen.  This is my new &quot;go-to&quot; recipe for pasta sauce.
1802776261,429838,2014-05-27,5,Love love love this sauce. My daughter recently went vegetarian and is always wanting spaghetti. I don&#039;t care for the jarred sauce myself but still needed something quick and easy to throw together for her. This is it. Definitely a keeper.
1802887113,429838,2014-07-04,2,"I&#039;m experimenting with different sauce recipes to find &quot;the one&quot; that works best. This definitely registered as more of a sweet sauce for me. Maybe I was tempted to try this out since I was breaking a cardinal rule I&#039;ve heard from my significant other&#039;s Neapolitan mother: never, ever cook onions and garlic together!&lt;br/&gt;&lt;br/&gt;After breaking said rule and risking my life, I have to say I agree. The carmelized onions add a sweetness to the sauce that seems to register well with American palates. I wouldn&#039;t say this felt as sweet as, say, Papa John&#039;s pizza sauce, but nevertheless makes me want to try a nice red sauce with just a lot of delicious crushed garlic instead. &lt;br/&gt;&lt;br/&gt;Otherwise, I think the suggested portions of spices worked out fine. I only added a pinch of brown sugar. Oh, and I felt this recipe was missing black pepper and added about a teaspoon or so."
2288695,429838,2014-10-29,5,I made this because I had no tomato sauce in the house but plenty of Muir Glen diced tomatoes.  This was so good I may never buy tomato sauce again.  The extra effort was worth it.
11154472,429838,2014-12-04,5,"I just made this a few minutes ago, I had no bottled sauce in the house.  I&#039;ve been meaning to make it, and my son just tasted it and then ate it straight up from a mug.  I will make this again,  and probably add a little wine as another cook suggested.  I used my imersion blender to smooth it out a bit.&lt;br/&gt;&lt;br/&gt;Terrific recipe."
1803540083,429838,2014-12-22,5,This was very quick and tastey. I added a can of red pepper diced Tamatoes to it as well because I like my sauce with more spice. I also added hot Italian sausage while saut
427184,429838,2014-12-28,5,"MUCH better then canned sauce. This will be a staple, thank you!"
2000449926,429838,2015-09-03,5,So yummy and easy! Added tomato paste and a bit more sugar but will be using this recipe again in the future
